date,global_id,zeitgeist_rank,clean_title,source,description,nyt_section,web_url,pillar,gemini_used
2026-06-02,2026-06-02_2,2,Trump Failed to Heed  Years of Iran’s Threats  To Close Hormuz Strait,The New York Times,"Over the past two decades, Iran repeatedly threatened to close down the waterway. President Trump underestimated Iran’s ability to do so.",U.S.,https://www.nytimes.com/2026/06/02/us/politics/trump-iran-strait-of-hormuz.html,Politics & Civic Life,False
2026-06-02,2026-06-02_3,3,Graham Platner Meets With Senate Democrats Amid Texting Scandal,The New York Times,"Mr. Platner, the likely Democratic nominee for Senate in Maine, met in Washington with several senators. Chuck Schumer, the minority leader, dodged questions about his confidence in Mr. Platner.",U.S.,https://www.nytimes.com/2026/06/02/us/politics/platner-senate-democrats-washington-meeting.html,Politics & Civic Life,False
2026-06-02,2026-06-02_4,4,White House Cuts Housing Aid for Homeless,The New York Times,Congress and a court blocked a previous effort to revamp homeless programs. Even a scaled-back version marks the sharpest change in homelessness policy in a generation.,U.S.,https://www.nytimes.com/2026/06/02/us/politics/housing-first-homeless-hud.html,Politics & Civic Life,False
2026-06-02,2026-06-02_5,5,"When to Expect Results in New Jersey, Iowa and Beyond",The New York Times,Voters in six states have primaries today. Election officials predict that results will come in late Tuesday or early Wednesday.,U.S.,https://www.nytimes.com/2026/06/02/us/politics/results-timing-iowa-montana-new-mexico.html,Politics & Civic Life,False
2026-06-02,2026-06-02_6,6,California House Primaries Offer Clues in Battle for Control of Congress,The New York Times,Proposition 50 has created a handful of key races where Democrats will choose candidates to pit against vulnerable Republican incumbents. Generational challenges have infused other contests.,U.S.,https://www.nytimes.com/2026/06/02/us/politics/california-house-election-primary.html,Politics & Civic Life,False
2026-06-02,2026-06-02_7,7,5 Things to Know About Tom Steyer,The New York Times,He is a billionaire who appeals to many progressive groups in California.,U.S.,https://www.nytimes.com/2026/06/02/us/politics/tom-steyer-california-governor.html,Politics & Civic Life,False
2026-06-02,2026-06-02_8,8,Republican Switcheroo Stifled Competition to Succeed Steve Daines in Montana,The New York Times,"Senator Steve Daines withdrew his candidacy for re-election moments before the filing deadline, and then endorsed Kurt Alme in what appeared to be a coordinated swap to preclude competition.",U.S.,https://www.nytimes.com/2026/06/02/us/politics/montana-republican-senate-primary-daines-alme.html,Politics & Civic Life,False
2026-06-02,2026-06-02_9,9,Judge Blocks Rebrand Push By News Outlet Using ‘The Star’,The New York Times,"NOTUS, a political news website, must temporarily suspend its plans to rebrand, a judge ruled in a trademark dispute brought by The Washington Star.",Business,https://www.nytimes.com/2026/06/02/business/media/notus-washington-star-trademark-dispute.html,Business & Finance,False
2026-06-02,2026-06-02_10,10,Billionaires and Silicon Valley Have Flooded California’s Races With Cash,The New York Times,"Tom Steyer has spent a staggering $216 million on his campaign for governor. Tech titans have lined up behind one of his rivals. And in other races, rich donors are spending big.",U.S.,https://www.nytimes.com/2026/06/02/us/politics/california-primary-midterms-election-spending.html,Politics & Civic Life,False
2026-06-01,2026-06-01_1,1,"Mavericks Pass on Dallas City Hall Site, Choosing Ex-Mall for New Arena",The New York Times,The choice gives the N.B.A. franchise room to pursue a sprawling mixed-use development while easing pressure on one of Dallas’s most closely watched civic battles.,U.S.,https://www.nytimes.com/2026/06/01/us/dallas-mavericks-new-arena-valley-view-mall.html,Politics & Civic Life,False
2026-06-01,2026-06-01_2,2,U.S. Says More People May Be Charged in Terror Case Linked to Iran,The New York Times,A militia leader pleaded not guilty on Monday to what prosecutors say is his role in attacks that are part of Iran’s response to the war with Israel and the United States.,New York,https://www.nytimes.com/2026/06/01/nyregion/nyc-synagogue-plot-iran.html,Politics & Civic Life,True
2026-06-01,2026-06-01_3,3,"Rick Adelman, 79, Coach Who Made Hall of Fame and Two N.B.A. Finals",The New York Times,"His teams made the playoffs 16 times in 23 seasons, and he twice steered the Portland Trail Blazers to the league finals.",Sports,https://www.nytimes.com/2026/06/01/sports/basketball/rick-adelman-dead.html,Sports & Athletics,False
2026-06-01,2026-06-01_4,4,"After a Miracle and a Bit of Luck, Endangered Crested Ibises Fly Freely in Japan",The New York Times,"Once widespread in Japan, the colorful birds went from being fairly commonplace in the country to being on the verge of extinction.",World,https://www.nytimes.com/2026/06/01/world/asia/japan-crested-ibis.html,Politics & Civic Life,False
2026-06-01,2026-06-01_5,5,A Colombian Aligns With Trump’s Drug-Fighting Vision for Latin America,The New York Times,"Abelardo De La Espriella, a hard-line candidate on the right facing a left-wing rival in a presidential runoff, has pledged to crush drug traffickers.",World,https://www.nytimes.com/2026/06/01/world/americas/trump-colombia-election-abelardo-de-la-espriella.html,Politics & Civic Life,False
2026-06-01,2026-06-01_6,6,Right-Wing Officials’ Attendance at Israel Day Parade Angers Lawmakers,The New York Times,"Parade organizers and New York lawmakers who marched in the parade sought to distance themselves from Bezalel Smotrich, a hard-line Israeli official who attended.",New York,https://www.nytimes.com/2026/06/01/nyregion/nyc-israel-parade-smotrich-mamdani.html,Politics & Civic Life,True
2026-06-01,2026-06-01_7,7,Map: 6.2-Magnitude Earthquake Strikes off the Coast of Italy,The New York Times,View the location of the quake’s epicenter and shake area.,World,https://www.nytimes.com/interactive/2026/06/01/world/italy-quake-tracker.html,Politics & Civic Life,False
2026-06-01,2026-06-01_8,8,High-Wire Negotiations With Iran? Trump Finds It ‘Very Boring.’,The New York Times,President Trump told CNBC that he “couldn’t care less” if the negotiations with Iran break down.,U.S.,https://www.nytimes.com/2026/06/01/us/politics/trump-iran-negotiations-boring.html,Politics & Civic Life,False
2026-06-01,2026-06-01_9,9,Denmark’s Prime Minister Hangs On to Power After Protracted Talks,The New York Times,"Mette Frederiksen may not be nearly as popular as she once was, but she remains the Danes’ most dominant leader in decades.",World,https://www.nytimes.com/2026/06/01/world/europe/denmark-mette-frederiksen.html,Politics & Civic Life,False
2026-06-01,2026-06-01_10,10,Trump Administration Kills Ocean Monitoring System,The New York Times,The $368 million network of instruments collecting data in both the Atlantic and Pacific has been critical to climate and ocean research.,Climate,https://www.nytimes.com/2026/06/01/climate/ocean-observatories-initiative.html,Science & Technology,False
2026-05-31,2026-05-31_1,1,10-Minute Challenge: ‘The Painted Room’ by Lois Dodd,The New York Times,"We’d like you to look at one piece of art for 10 minutes, uninterrupted.",The Upshot,https://www.nytimes.com/interactive/2026/05/31/upshot/ten-minute-challenge-dodd.html,Entertainment & Pop Culture,True
2026-05-31,2026-05-31_2,2,"2025 Wildfires Were World’s Costliest Ever, Study Says, With Populated Areas Hit",The New York Times,"Severe, hard-to-control blazes in densely populated areas like Los Angeles drove the year’s record losses.",Climate,https://www.nytimes.com/2026/05/31/climate/2025-wildfire-damage.html,Science & Technology,False
2026-05-31,2026-05-31_3,3,Map: 6.0-Magnitude Earthquake Strikes off the Coast of Chile,The New York Times,View the location of the quake’s epicenter and shake area.,World,https://www.nytimes.com/interactive/2026/05/31/world/chile-quake-tracker.html,Politics & Civic Life,False
2026-05-31,2026-05-31_4,4,Core Belief,The New York Times,Kenneth Cortes does the crossword proud.,Gameplay,https://www.nytimes.com/2026/05/31/crosswords/daily-puzzle-2026-06-01.html,Entertainment & Pop Culture,True
2026-05-31,2026-05-31_5,5,"Notre Dame Students Abused by Priest in ‘Weighing Scheme,’ Report Finds",The New York Times,An investigation commissioned by Notre Dame found that the Catholic university could have done more to respond to allegations of sexual misconduct.,U.S.,https://www.nytimes.com/2026/05/31/us/notre-dame-students-abused-by-priest-in-weighing-scheme-report-finds.html,Politics & Civic Life,False
2026-05-31,2026-05-31_6,6,"For Hawaii’s Coffee Farmers, an Earthquake Creates a Water Crisis",The New York Times,"An earthquake destroyed many water catchment systems on Hawaii’s Big Island, capping a spring filled with devastating floods.",U.S.,https://www.nytimes.com/2026/05/31/us/kona-hawaii-coffee-fields-water.html,Politics & Civic Life,False
2026-05-31,2026-05-31_7,7,China Exports Surveillance,The New York Times,"The country has spent decades perfecting a surveillance state at home. Now it’s promoting its ideology of state control, and the technology to enforce it, abroad.",World,https://www.nytimes.com/2026/05/31/world/china-surveillance-solomon-islands-trump-nepal.html,Politics & Civic Life,False
2026-05-31,2026-05-31_8,8,U.S. Military Is Quietly Guiding Ships Through the Strait of Hormuz,The New York Times,"U.S. Central Command has helped around 70 commercial ships pass through the strait in the last three weeks, an official said.",Business,https://www.nytimes.com/2026/05/31/business/us-military-guides-strait-of-hormuz.html,Business & Finance,False
2026-05-31,2026-05-31_9,9,"In Stalemates,  Trump’s Talk  Meets Reality",The New York Times,"In Ukraine, Gaza and now Iran, President Trump’s early declarations of easy wins have given way to harsh reality.",U.S.,https://www.nytimes.com/2026/05/31/us/politics/trump-iran-stalemate-ukraine-gaza.html,Politics & Civic Life,False
2026-05-31,2026-05-31_10,10,Booker Notes His ‘Concerns’  About Platner And His Texts,The New York Times,"Graham Platner, whose contest in Maine is a key to Democrats’ hopes of winning the Senate, sought to discredit reports that he had exchanged sexual messages with women outside his marriage.",U.S.,https://www.nytimes.com/2026/05/31/us/politics/booker-platner-democrats-senate-midterms.html,Politics & Civic Life,False
2026-05-30,2026-05-30_1,1,"How Sudden I.R.S. Deal, Catered to Trump’s Aims, Was Made",The New York Times,Discussions among a group of lawyers with allegiance to the president were closely held. Some senior White House officials were said to have felt blindsided as the agreement took shape.,U.S.,https://www.nytimes.com/2026/05/30/us/politics/trump-irs-lawsuit-deal.html,Politics & Civic Life,False
2026-05-30,2026-05-30_2,2,"In Wake of Protests, Immigration Center to Reopen for Visitors",The New York Times,Gov. Mikie Sherrill and other New Jersey elected officials have urged calm as demonstrators clashed with police while protesting conditions at the immigration detention center.,New York,https://www.nytimes.com/2026/05/30/nyregion/delaney-hall-mikie-sherrill.html,Politics & Civic Life,True
2026-05-30,2026-05-30_3,3,"Edgar Morin, the ‘Grandfather’ of French Intellectuals, Is Dead at 104",The New York Times,"A former member of the Resistance, he went on to a career spanning eras and disciplines. His books and pronouncements carried moral authority.",World,https://www.nytimes.com/2026/05/30/world/europe/edgar-morin-dead.html,Politics & Civic Life,False
2026-05-30,2026-05-30_4,4,C.I.A. Officer Arrested With Gold Once Worked With No. 2 Pentagon Official,The New York Times,"David Rush, a longtime C.I.A. officer, appears to have first had contact with Stephen A. Feinberg during President Trump’s first term. Some officials said the two men were not close.",U.S.,https://www.nytimes.com/2026/05/30/us/politics/cia-gold-bars-stephen-feinberg.html,Politics & Civic Life,False
2026-05-30,2026-05-30_5,5,"Senator Dan Sullivan Has a Challenger In Alaska, and His Name Is Dan Sullivan",The New York Times,"Two candidates with the same name will be on the ballot seeking the same seat in the state’s primary. “It’s going to be confusing,” one Republican said.",U.S.,https://www.nytimes.com/2026/05/30/us/politics/dan-sullivan-election-senate-alaska.html,Politics & Civic Life,False
2026-05-30,2026-05-30_6,6,Target Practice,The New York Times,Jeffrey Martinovic and Evan Park hit the bull’s-eye with their Sunday puzzle collaboration.,Gameplay,https://www.nytimes.com/2026/05/30/crosswords/daily-puzzle-2026-05-31.html,Entertainment & Pop Culture,True
2026-05-30,2026-05-30_7,7,"Boom Near Boston Caused by a Falling Rock, NASA Says",The New York Times,"A fireball reached 75,000 miles per hour before breaking up miles above New England, NASA said, causing a boom that alarmed residents. The incident followed a similar event in South Carolina.",U.S.,https://www.nytimes.com/2026/05/30/us/boston-area-boom.html,Politics & Civic Life,False
2026-05-30,2026-05-30_8,8,"As Acts Quit Freedom 250, Trump Says He’ll Be the Star",The New York Times,"The president had earlier said on social media that he should take the place of “these highly paid, Third Rate ‘Artists,’” saying he gets “larger audiences than Elvis.”",Arts,https://www.nytimes.com/2026/05/30/arts/music/trump-freedom-250-concert-cancellations.html,Entertainment & Pop Culture,False
2026-05-30,2026-05-30_9,9,ICE Agent  Who Shot  Immigrant  Is Arrested,The New York Times,The agent was charged in Minnesota with assault and filing a false police report in the shooting of an immigrant from Venezuela.,U.S.,https://www.nytimes.com/2026/05/30/us/ice-agent-arrested-texas-minnesota-shooting.html,Politics & Civic Life,False
2026-05-30,2026-05-30_10,10,Storm Blasts New England With Cold and Wind,The New York Times,Residents ready for summer lamented the unusual late May weather.,Weather,https://www.nytimes.com/2026/05/30/weather/new-england-cold-weather-storm-power-outages.html,Science & Technology,True
2026-05-29,2026-05-29_1,1,Iran’s Hard-Liners Try to Derail Potential Deal With the U.S.,The New York Times,"A political fight is playing out in Iran, where the small but loud faction of hard-liners has used rallies, state media and private and public statements to try to undermine negotiations.",World,https://www.nytimes.com/2026/05/29/world/middleeast/irans-hard-liners-deal.html,Politics & Civic Life,False
2026-05-29,2026-05-29_2,2,ICE Protesters Convicted in a Case That Tested a Trump Strategy,The New York Times,"The three demonstrators in Spokane, Wash., had been accused of conspiracy, charges that the region’s former top prosecutor has said were unwarranted.",U.S.,https://www.nytimes.com/2026/05/29/us/ice-protesters-convicted-spokane.html,Politics & Civic Life,False
2026-05-29,2026-05-29_3,3,Federal Agents Leaving Detention Center Protest Site,The New York Times,Clashes between protesters and armed federal agents have erupted at the parking lot of Delaney Hall in Newark since the Memorial Day weekend.,New York,https://www.nytimes.com/2026/05/29/nyregion/ice-protests-delaney-hall-nj.html,Politics & Civic Life,True
2026-05-29,2026-05-29_4,4,Now D.H.S. Says Most May Await Approval Of Green Cards in U.S.,The New York Times,"But details remained scant after officials said last week that, with “extraordinary” exceptions, people seeking permanent residency must first leave the country.",U.S.,https://www.nytimes.com/2026/05/29/us/politics/green-cards-dhs.html,Politics & Civic Life,False
2026-05-29,2026-05-29_5,5,Trump Endorses Lieutenant Governor in South Carolina Governor’s Race,The New York Times,Pamela Evette had been among the most vocal proponents of redrawing the state’s congressional map to help Republicans in the midterms.,U.S.,https://www.nytimes.com/2026/05/29/us/trump-pamela-evette-south-carolina-governor.html,Politics & Civic Life,False
2026-05-29,2026-05-29_6,6,Justice Department Lurches Toward Trump’s Goals,The New York Times,"Plus, the Kennedy Center must remove Trump’s name. Here’s the latest at the end of Friday.",Briefing,https://www.nytimes.com/2026/05/29/briefing/trump-irs-kennedy-center.html,Politics & Civic Life,True
2026-05-29,2026-05-29_7,7,Canadian Man Pleads Guilty to Aiding 14 Suicides,The New York Times,"Kenneth Law, who ran an online business that shipped toxic salt to customers in 40 countries, also admitted to causing the deaths of 79 people in Britain, prosecutors said.",World,https://www.nytimes.com/2026/05/29/world/canada/kenneth-law-canada-poison.html,Politics & Civic Life,False
2026-05-29,2026-05-29_8,8,Issues in the Carroll Inquiry,The New York Times,"Prosecutors would face substantial hurdles in potentially pursuing charges against Ms. Carroll, who twice won cases against Donald Trump, or the billionaire who helped pay her lawyers.",U.S.,https://www.nytimes.com/2026/05/29/us/politics/carroll-hoffman-legal-explainer.html,Politics & Civic Life,False
2026-05-29,2026-05-29_9,9,Courts Deal Twin Blows To Trump on I.R.S. Case And the Kennedy Center,The New York Times,"The ruling was a blow to both President Trump, who had voluntarily dismissed the suit last week, and to the Justice Department, which used the suit to establish a fund likely intended for Trump allies.",U.S.,https://www.nytimes.com/2026/05/29/us/politics/trump-irs-lawsuit-ruling.html,Politics & Civic Life,False
2026-05-29,2026-05-29_10,10,Can Talarico win over some of Cornyn’s voters in Texas?,The New York Times,"Democrats hope so, but there are good reasons to be skeptical.",U.S.,https://www.nytimes.com/2026/05/29/us/politics/talarico-cornyn-texas-voters.html,Politics & Civic Life,False
2026-05-28,2026-05-28_1,1,Suit Says Black Infants Were Subjected to Experimental Vaccine Without Consent,The New York Times,The babies were part of a vaccine trial for a respiratory virus in the 1960s and died shortly after. Their families said they had been unaware of the trial until recently.,U.S.,https://www.nytimes.com/2026/05/28/us/rsv-vaccine-testing-lawsuit.html,Politics & Civic Life,False
2026-05-28,2026-05-28_2,2,"Trump’s Zigzagging Over Iran Baffles All Sides, Even His Own",The New York Times,President Trump’s pendulum swings on Iran have often seemed driven by mood and moment rather than any discernible strategy.,U.S.,https://www.nytimes.com/2026/05/28/us/politics/trump-approach-iran-war.html,Politics & Civic Life,False
2026-05-28,2026-05-28_3,3,Alaska Authorities Race to Rescue 4 Climbers Who Fell on Mount McKinley,The New York Times,The condition of the climbers was not immediately known.,U.S.,https://www.nytimes.com/2026/05/28/us/mount-mckinley-rescue-alaska.html,Politics & Civic Life,False
2026-05-28,2026-05-28_4,4,Who Are the 9 Scripps Spelling Bee Finalists?,The New York Times,"The remaining spellers are 12 to 14, and represent five states as well as the District of Columbia.",U.S.,https://www.nytimes.com/2026/05/28/us/scripps-spelling-bee-finalists.html,Politics & Civic Life,False
2026-05-28,2026-05-28_5,5,College Admissions Are Race-Blind. Jury Selection Is Not.,The New York Times,All Americans benefit from the outcome of this case. And yet the decision highlights just how much work still needs to be done.,Opinion,https://www.nytimes.com/2026/05/28/opinion/supreme-court-jury-discrimination.html,Politics & Civic Life,True
2026-05-28,2026-05-28_6,6,The spelling bee takes a game show approach to combat declining viewership.,The New York Times,,U.S.,https://www.nytimes.com/live/2026/05/28/us/scripps-spelling-bee/the-spelling-bee-takes-a-game-show-approach-to-combat-declining-viewership,Politics & Civic Life,False
2026-05-28,2026-05-28_7,7,ABC Accuses White House of Threatening Its Broadcast Licenses,The New York Times,"The TV network slammed the Federal Communications Commission, saying the regulator was targeting its station licenses in a campaign of “unconstitutional retaliation.”",Business,https://www.nytimes.com/2026/05/28/business/media/abc-licenses-fcc-brendan-carr.html,Business & Finance,False
2026-05-28,2026-05-28_8,8,"N.B.A. Player  Took a Bribe,  Charges Say",The New York Times,Terry Rozier faces new charges for his role in a betting scheme that prosecutors say involves former and current professional basketball players.,New York,https://www.nytimes.com/2026/05/28/nyregion/terry-rozier-nba-betting-scandal.html,Sports & Athletics,True
2026-05-28,2026-05-28_9,9,"From ‘clickbait’ to ‘nerfing,’ modern slang is shaking up the bee.",The New York Times,Internet slang and non-European terms are appearing more and more in the competition while words with Greek and Latin words are being used less.,U.S.,https://www.nytimes.com/live/2026/05/28/us/scripps-spelling-bee/from-clickbait-to-nerfing-modern-slang-is-shaking-up-the-bee,Politics & Civic Life,False
2026-05-28,2026-05-28_10,10,Late May Storm Brings Rain and Snow to California,The New York Times,"San Francisco received nearly as much rain one morning as it would typically see for the month, and a slope in the Sierra Nevada remained open for skiing.",Weather,https://www.nytimes.com/2026/05/28/weather/may-snow-rain-california.html,Science & Technology,True
2026-05-27,2026-05-27_1,1,"In California, Acting to Protect Election Integrity",The New York Times,Gov. Gavin Newsom signed legislation that tries to stop outside officials from taking ballots or getting involved in ballot processing.,U.S.,https://www.nytimes.com/2026/05/27/us/california-election-security-newsom.html,Politics & Civic Life,False
2026-05-27,2026-05-27_2,2,"In Flint, Cash Given to Pregnant Women Resulted in Better Outcomes for Babies",The New York Times,"New research suggests money with no strings attached can promote better health, but other studies have seen mixed results.",Well,https://www.nytimes.com/2026/05/27/well/pregnancy-money-assistance-flint.html,Lifestyle & Wellness,False
2026-05-27,2026-05-27_3,3,White House Dismisses Outline of ‘Unofficial’ Iran Deal,The New York Times,"Plus, hunting fish with a bow and arrow. Here’s the latest at the end of Wednesday.",Briefing,https://www.nytimes.com/2026/05/27/briefing/iran-reflecting-pool.html,Politics & Civic Life,True
2026-05-27,2026-05-27_4,4,"David Henderson, Innovative Poet and Hendrix Biographer, Dies at 83",The New York Times,"Part of the Black Arts Movement of the 1960s, he went on to reclaim a leading musician of the psychedelic era as a distinctly African American artist.",Books,https://www.nytimes.com/2026/05/27/books/david-henderson-dead.html,Entertainment & Pop Culture,False
2026-05-27,2026-05-27_5,5,Tariff Refunds  Draw Scrutiny  Of Trade Court,The New York Times,The surprising demand to appear at a hearing suggested new concern about the Trump administration’s efforts to repay the full $166 billion owed from illegally imposed tariffs.,U.S.,https://www.nytimes.com/2026/05/27/us/politics/trade-court-customs-chief-tariff-refunds.html,Politics & Civic Life,False
2026-05-27,2026-05-27_6,6,"At ’24 Debate, Biden’s Wife Worried He Had a Stroke",The New York Times,"“I had never, ever seen Joe like that,” the former first lady told CBS News. “Before or since.”",U.S.,https://www.nytimes.com/2026/05/27/us/politics/jill-biden-joe-biden-2024-debate.html,Politics & Civic Life,False
2026-05-27,2026-05-27_7,7,"Cease-Fires, but No Peace",The New York Times,A truce isn’t necessarily doomed if the missiles are still flying. Here’s why.,World,https://www.nytimes.com/2026/05/27/world/cease-fires-peace-lebanon-israel-iran.html,Politics & Civic Life,False
2026-05-27,2026-05-27_8,8,Condé Nast Settles Dispute With 3 Writers Over Dismissals,The New York Times,The former workers were among a group of employees who confronted the company’s head of human resources about layoffs last fall.,Business,https://www.nytimes.com/2026/05/27/business/media/conde-nast-fired-journalists-settlement.html,Business & Finance,False
2026-05-27,2026-05-27_9,9,Measles Infects Babies in Utah as Cases Rise,The New York Times,"Many of those who can’t be vaccinated, including pregnant women and immunocompromised people, are also at high risk of serious complications.",Well,https://www.nytimes.com/2026/05/27/well/utah-measles-unvaccinated-babies.html,Lifestyle & Wellness,False
2026-05-27,2026-05-27_10,10,F.B.I. Arrests C.I.A. Official With $40 Million in Gold Bars in His Home,The New York Times,The only charge lodged against David Rush is that he inflated his academic credentials and obtained military leave pay worth tens of thousands of dollars.,U.S.,https://www.nytimes.com/2026/05/27/us/politics/fbi-arrest-cia-official-gold-bars.html,Politics & Civic Life,False
2026-05-26,2026-05-26_1,1,"Donald E. Newhouse, Low-Profile Heir to Media Empire, Dies at 96",The New York Times,"He ran the newspaper division of Advance Publications, while his older brother, Si, ran the Condé Nast magazine operation.",Business,https://www.nytimes.com/2026/05/26/business/media/donald-e-newhouse-dead.html,Business & Finance,False
2026-05-26,2026-05-26_2,2,Trump Considers Going  To Finals at the Garden,The New York Times,"President Trump is said to be considering the appearance after his hometown team, the Knicks, clinched a championship spot.",U.S.,https://www.nytimes.com/2026/05/26/us/politics/trump-nba-finals.html,Politics & Civic Life,False
2026-05-26,2026-05-26_3,3,How Does Kennedy Rate As a Wrangler of Snakes?,The New York Times,The health secretary wrangled two nonvenomous snakes while visiting Florida in a video that drew widespread attention.,U.S.,https://www.nytimes.com/2026/05/26/us/rfk-jr-snakes-video-safety.html,Politics & Civic Life,False
