date,global_id,zeitgeist_rank,clean_title,source,description,nyt_section,web_url,pillar,gemini_used
2026-06-09,2026-06-09_1,1,Kalshi Will Ask  Users to Name Their Employer In Risky Trades,The New York Times,The new policy is aimed at limiting insider trading as scrutiny of prediction markets grows.,U.S.,https://www.nytimes.com/2026/06/09/us/kalshi-employment-disclosure-rules.html,Politics & Civic Life,False
2026-06-09,2026-06-09_2,2,Maine Senate Polls Point to a Competitive General Election,The New York Times,Graham Platner is expected to win handily in the Democratic primary for Senate in Maine. The focus is shifting to how he might do in November.,U.S.,https://www.nytimes.com/2026/06/09/us/elections/maine-senate-polls-competitive-general.html,Politics & Civic Life,False
2026-06-09,2026-06-09_3,3,Polling Is Sparse in Maine’s Primaries for Governor,The New York Times,"The Democratic primary for governor is particularly competitive, but polls show that both party’s primaries could come down to ranked-choice voting.",Polls,https://www.nytimes.com/2026/06/09/polls/maine-governor-primary-polls.html,Politics & Civic Life,True
2026-06-09,2026-06-09_4,4,Hilton Wins Second Spot In Race to Lead California,The New York Times,"Steve Hilton, a Republican endorsed by President Trump, will face Xavier Becerra, a Democrat, in the general election. Tom Steyer, another Democrat, will not advance.",U.S.,https://www.nytimes.com/2026/06/09/us/steve-hilton-california-governor-xavier-becerra.html,Politics & Civic Life,False
2026-06-09,2026-06-09_5,5,5 Things to Know About Paul LePage,The New York Times,Mr. LePage served two terms as governor of Maine and was known for his incendiary rhetoric and his vetoing of legislation of all sorts.,U.S.,https://www.nytimes.com/2026/06/09/us/politics/paul-lepage-republican-house-maine.html,Politics & Civic Life,False
2026-06-09,2026-06-09_6,6,Jurors Balked at Indicting ICE Protesters. Prosecutors Kept Pushing.,The New York Times,Newly released transcripts showed a Chicago prosecutor repeatedly urging grand jurors to indict protesters of the Trump administration’s immigration crackdown.,U.S.,https://www.nytimes.com/2026/06/09/us/chicago-prosecutors-immigration-grand-jury.html,Politics & Civic Life,False
2026-06-09,2026-06-09_7,7,"House Passes Union Contract Bill, Bucking Republican Leaders",The New York Times,Twenty G.O.P lawmakers broke with Speaker Mike Johnson and joined Democrats in backing a bill to amend the National Labor Relations Act.,U.S.,https://www.nytimes.com/2026/06/09/us/politics/house-passes-union-contract-bill-bucking-republican-leaders.html,Politics & Civic Life,False
2026-06-09,2026-06-09_8,8,5 Things to Know About Graham Platner,The New York Times,"Mr. Platner, an oyster farmer running for a Senate seat on a progressive platform, has drawn a large following among Democrats in Maine. His campaign has also surfaced damaging reports about his personal history.",U.S.,https://www.nytimes.com/2026/06/09/us/politics/graham-platner-democrat-senate-maine.html,Politics & Civic Life,False
2026-06-09,2026-06-09_9,9,5 Things to Know About Senator Susan Collins of Maine,The New York Times,"Ms. Collins, the longest-serving Republican woman in Senate history, is also her party’s most vulnerable incumbent this year.",U.S.,https://www.nytimes.com/2026/06/09/us/politics/susan-collins-republican-senate-maine.html,Politics & Civic Life,False
2026-06-09,2026-06-09_10,10,Doris Matsui Will Face Democratic Challenger in Intraparty Generational Fight,The New York Times,"Mai Vang, a progressive member of the Sacramento City Council, will challenge Ms. Matsui, the 81-year-old incumbent, in the general election.",U.S.,https://www.nytimes.com/2026/06/09/us/politics/california-house-district-7.html,Politics & Civic Life,False
2026-06-08,2026-06-08_1,1,Democrat Secures Second Spot in Runoff Against Mayor of Los Angeles,The New York Times,"Nithya Raman, a progressive Democrat who entered the mayoral race at the last minute, secured the second spot to face Mayor Karen Bass in November. Her comeback sets up an intraparty battle.",U.S.,https://www.nytimes.com/2026/06/08/us/elections/nithya-raman-la-mayor-karen-bass.html,Politics & Civic Life,False
2026-06-08,2026-06-08_2,2,Wonder What a Renovated Penn Station Might Look Like? Here’s a Preview.,The New York Times,"Forget those dreary passageways. The updated transit hub would add a grand entrance with sweeping staircases leading to an airy, glass-walled concourse.",New York,https://www.nytimes.com/2026/06/08/nyregion/penn-station-renovation.html,Politics & Civic Life,True
2026-06-08,2026-06-08_3,3,Man Fatally Shot on a Bus in the Bronx,The New York Times,"A 41-year-old man was shot in the abdomen on a Bx36 bus on Monday after getting into an argument with the shooter. The gunman remains at large, the police said.",New York,https://www.nytimes.com/2026/06/08/nyregion/bronx-bus-fatal-shooting.html,Politics & Civic Life,True
2026-06-08,2026-06-08_4,4,Sherrill Says Visit to ICE Facility Was Strictly Limited,The New York Times,Gov. Mikie Sherrill of New Jersey said she was not allowed to speak with immigrants at the Delaney Hall detention center.,New York,https://www.nytimes.com/2026/06/08/nyregion/sherrill-nj-delaney-hall.html,Politics & Civic Life,True
2026-06-08,2026-06-08_5,5,Trump Seeds Ballot Doubts In Fall Preview,The New York Times,"The president is using the slow count of mail ballots in California to renew his effort to cast doubt on election outcomes he doesn’t like, despite a lack of evidence of any widespread fraud.",U.S.,https://www.nytimes.com/2026/06/08/us/politics/trump-election-fraud-strategy-california.html,Politics & Civic Life,False
2026-06-08,2026-06-08_6,6,Three Questions About the Maine and South Carolina Primaries,The New York Times,Graham Platner and Lindsey Graham are both hoping for comfortably big victories.,U.S.,https://www.nytimes.com/2026/06/08/us/politics/maine-south-carolina-primaries.html,Politics & Civic Life,False
2026-06-08,2026-06-08_7,7,Young Knicks fans have extra confidence about the team’s finals run.,The New York Times,,New York,https://www.nytimes.com/live/2026/06/08/nyregion/nba-finals-trump-knicks-spurs-mamdani/young-knicks-fans-have-extra-confidence-about-the-teams-finals-run,Sports & Athletics,True
2026-06-08,2026-06-08_8,8,Pentagon Again Revises Religious Categories for Troops,The New York Times,"The Defense Department made the change after lawmakers objected to its original list, which did not include the Latter-day Saints among traditions labeled Christian.",U.S.,https://www.nytimes.com/2026/06/08/us/pentagon-religious-list-troops.html,Politics & Civic Life,False
2026-06-08,2026-06-08_9,9,"Trump Wants to Call the Shots. But in Iran, He Keeps Hitting His Limits.",The New York Times,"President Trump is grappling with his own version of the sort of Middle East crisis that beset his predecessors, and that he promised to avoid.",U.S.,https://www.nytimes.com/2026/06/08/us/politics/trump-iran-war-middle-east.html,Politics & Civic Life,False
2026-06-08,2026-06-08_10,10,"Hoyle Schweitzer, 93, Who Took Windsurfing to Masses on Flat and Choppy Water",The New York Times,"With his friend Jim Drake, he built the Windsurfer, a sailboard that was cheaper and more portable than most sailboats. It became a global phenomenon.",Business,https://www.nytimes.com/2026/06/08/business/hoyle-schweitzer-dead.html,Business & Finance,False
2026-06-07,2026-06-07_1,1,Pink Is Hosting Tonight’s Tony Awards,The New York Times,"The pop star, a former theater kid, will also perform on Sunday. Her theater-loving daughter approves of the gig.",Theater,https://www.nytimes.com/2026/06/07/theater/tonys-host-pink.html,Entertainment & Pop Culture,False
2026-06-07,2026-06-07_2,2,"Huge American Flag Flies Into Power Lines, Knocking Out Power for Thousands",The New York Times,"The flag hit transmission lines on Saturday night, affecting 5,000 customers in Connecticut. In a separate episode on Sunday, 40,000 customers lost power, according to Eversource Energy.",New York,https://www.nytimes.com/2026/06/07/nyregion/american-flag-power-outages-connecticut.html,Politics & Civic Life,True
2026-06-07,2026-06-07_3,3,A middle-school teacher who’s sent students to Broadway wins excellence in education award.,The New York Times,,Theater,https://www.nytimes.com/live/2026/06/07/theater/tony-awards-2026/a-middle-school-teacher-whos-sent-students-to-broadway-wins-excellence-in-education-award,Entertainment & Pop Culture,False
2026-06-07,2026-06-07_4,4,Who is going to win tonight?,The New York Times,,Theater,https://www.nytimes.com/live/2026/06/07/theater/tony-awards-2026/who-is-going-to-win-tonight,Entertainment & Pop Culture,False
2026-06-07,2026-06-07_5,5,American Players Theater is receiving the regional theater award.,The New York Times,,Theater,https://www.nytimes.com/live/2026/06/07/theater/tony-awards-2026/american-players-theater-is-receiving-the-regional-theater-award,Entertainment & Pop Culture,False
2026-06-07,2026-06-07_6,6,"André Bishop, Jules Fisher and James Lapine to receive lifetime achievement awards.",The New York Times,,Theater,https://www.nytimes.com/live/2026/06/07/theater/tony-awards-2026/andre-bishop-jules-fisher-and-james-lapine-to-receive-lifetime-achievement-awards,Entertainment & Pop Culture,False
2026-06-07,2026-06-07_7,7,Tony Award Winners,The New York Times,The Tony Awards were held at Radio City Music Hall in New York City.,Theater,https://www.nytimes.com/2026/06/07/theater/tony-award-winners-2026-the-updating-list.html,Entertainment & Pop Culture,False
2026-06-07,2026-06-07_8,8,38 Tony nominees on the strangest skills they’ve picked up for a show.,The New York Times,,Theater,https://www.nytimes.com/live/2026/06/07/theater/tony-awards-2026/38-tony-nominees-on-the-strangest-skills-theyve-picked-up-for-a-show,Entertainment & Pop Culture,False
2026-06-07,2026-06-07_9,9,Shining With Every Step,The New York Times,"As Broadway’s brightest gathered for the industry’s biggest night, here’s an up-close look at what you couldn’t see on TV.",Theater,https://www.nytimes.com/2026/06/07/theater/our-favorite-photos-from-the-tony-awards-red-carpet.html,Entertainment & Pop Culture,False
2026-06-07,2026-06-07_10,10,"Robert Coles, a Caring Child Psychiatrist With a Pulitzer, Dies at 97",The New York Times,"His five-volume “Children of Crisis” series, published between 1967 and 1977, drew on his conversations with American children whose voices were not often heard.",U.S.,https://www.nytimes.com/2026/06/07/us/robert-coles-dead.html,Politics & Civic Life,False
2026-06-06,2026-06-06_1,1,"Despite Protest, Ye Takes the Stage for Thousands of European Fans",The New York Times,"Nearly 40,000 fans came out to hear the rapper formerly known as Kanye West in the Netherlands on Saturday, even as other European countries had canceled his concerts.",Arts,https://www.nytimes.com/2026/06/06/arts/music/ye-concert-bully-tour-netherlands.html,Entertainment & Pop Culture,False
2026-06-06,2026-06-06_2,2,"At Least 12 People Shot Near Street Festival in Toledo, Ohio, Police Say",The New York Times,"Two people appeared to have fired at each other near the Old West End Festival, striking bystanders, the police said. No fatalities have been reported so far.",U.S.,https://www.nytimes.com/2026/06/06/us/toledo-ohio-shooting-festival.html,Politics & Civic Life,False
2026-06-06,2026-06-06_3,3,"Bernadette Chirac, 93, Fierce Ex-First Lady of France",The New York Times,"Long seen as the cool, coifed wife of the president, she emerged as a political player in her own right, as well as a relentless champion of charities.",World,https://www.nytimes.com/2026/06/06/world/europe/bernadette-chirac-dead.html,Politics & Civic Life,False
2026-06-06,2026-06-06_4,4,Senators Warn of Intelligence Gaps if Surveillance Program Expires,The New York Times,Two senior Republicans urged the Trump administration to prepare for the possible expiration of a contentious intelligence-gathering authority.,U.S.,https://www.nytimes.com/2026/06/06/us/politics/cotton-grassley-surveillance-program.html,Politics & Civic Life,False
2026-06-06,2026-06-06_5,5,Judge’s Ruling Renews Hope for Immigrants Seeking to Stay in the U.S.,The New York Times,"After a judge’s ruling, there was a sense of renewed hope that immigration applications that were put on hold would move forward. But how soon that would happen was unknown.",U.S.,https://www.nytimes.com/2026/06/06/us/an-uncertain-win-for-immigrants-seeking-to-stay-in-us.html,Politics & Civic Life,False
2026-06-06,2026-06-06_6,6,A Haiti Captain Reaches Out to a Very Distant Past of Successful Qualifying,The New York Times,"A player from Haiti’s 1974 World Cup team, the last to qualify for the tournament, met with the co-captain of this year’s squad in South Florida.",U.S.,https://www.nytimes.com/2026/06/06/us/ahead-of-world-cup-two-generations-of-haitian-players-unite.html,Politics & Civic Life,False
2026-06-06,2026-06-06_7,7,Judge Tosses Center’s Suit Over Artist Who Quit,The New York Times,"A judge sided with jazz performer Chuck Redd, who canceled a 2025 holiday concert after President Trump’s name was added to the building.",U.S.,https://www.nytimes.com/2026/06/06/us/politics/kennedy-center-lawsuit-tossed-trump-chuck-redd.html,Politics & Civic Life,False
2026-06-06,2026-06-06_8,8,Military Base Near St. Petersburg Is Targeted by Ukrainian Drones,The New York Times,It was the second such attack in days and came just hours after President Vladimir V. Putin spoke at an economic forum in the city.,World,https://www.nytimes.com/2026/06/06/world/europe/ukraine-drone-strike-st-petersburg.html,Politics & Civic Life,False
2026-06-06,2026-06-06_9,9,Split Seconds,The New York Times,Adam Wagner and Simeon Seigel combine forces on a puzzle that combines forces on its solvers.,Gameplay,https://www.nytimes.com/2026/06/06/crosswords/daily-puzzle-2026-06-07.html,Entertainment & Pop Culture,True
2026-06-06,2026-06-06_10,10,Barge Hits Maryland Rail Bridge Along Northeast Corridor,The New York Times,"Amtrak said crews were conducting a safety assessment for the bridge, which crosses the Susquehanna River in Maryland. The U.S. Coast Guard reported no injuries.",U.S.,https://www.nytimes.com/2026/06/06/us/maryland-bridge-amtrak-northeast-corridor.html,Politics & Civic Life,False
2026-06-05,2026-06-05_1,1,Xavier Becerra Advances in California Governor Race,The New York Times,Mr. Becerra was long dismissed in the contest until the abrupt departure of Eric Swalwell created a surprise path for an experienced Democrat.,U.S.,https://www.nytimes.com/2026/06/05/us/elections/becerra-california-governor.html,Politics & Civic Life,False
2026-06-05,2026-06-05_2,2,"Iran Fired Drones Toward Strait of Hormuz With U.S. Shooting Down at Least 4, U.S. Military Says",The New York Times,The latest violence between the United States and Iran threatened a cease-fire and risked further stoking tensions in the region.,U.S.,https://www.nytimes.com/2026/06/05/us/politics/iran-attack-drones-hormuz.html,Politics & Civic Life,False
2026-06-05,2026-06-05_3,3,"Iran’s Players Granted Visas, But Many Staff Denied Entry",The New York Times,"After months of doubts over their participation, Iran’s players have received visas for the United States just days before the World Cup begins.",World,https://www.nytimes.com/2026/06/05/world/middleeast/world-cup-iran-football-team-visas-war.html,Politics & Civic Life,False
2026-06-05,2026-06-05_4,4,Patel Said to Have Fired Five F.B.I. Analysts Over Memo on Catholic Extremists,The New York Times,It is the administration’s latest effort to force out law enforcement personnel it accuses of “weaponizing” the government against President Trump and his supporters.,U.S.,https://www.nytimes.com/2026/06/05/us/politics/patel-firings-richmond-memo.html,Politics & Civic Life,False
2026-06-05,2026-06-05_5,5,"Ebola Cases May Top 20,000 in Three Months, C.D.C. Says",The New York Times,"Still, the risk to people in the United States remains low, the Centers for Disease Control and Prevention said in a report Friday.",U.S.,https://www.nytimes.com/2026/06/05/us/politics/cdc-ebola-projection.html,Politics & Civic Life,False
2026-06-05,2026-06-05_6,6,See the Areas Where the L.A. Mayoral Candidates Built Their Coalitions,The New York Times,"A map of precinct returns shows where coalitions formed in the race between Karen Bass, Nithya Raman and Spencer Pratt.",U.S.,https://www.nytimes.com/interactive/2026/06/05/us/elections/los-angeles-mayor-primary-results-precinct-map.html,Politics & Civic Life,False
2026-06-05,2026-06-05_7,7,"Pamela Hicks, Lady-in-Waiting to Elizabeth II of Britain, Dies at 97",The New York Times,"The queen’s third cousin, she was a bridesmaid at the royal wedding in 1947, and witnessed firsthand pivotal moments in British history.",World,https://www.nytimes.com/2026/06/05/world/europe/pamela-hicks-dead.html,Politics & Civic Life,False
2026-06-05,2026-06-05_8,8,Justice Dept. Promises to Drop $1.8 Billion Fund,The New York Times,It was the department’s clearest statement to date that it was pulling back from a plan to use taxpayer money to make payments to people who claimed to have been politically persecuted.,U.S.,https://www.nytimes.com/2026/06/05/us/politics/trump-fund-doj.html,Politics & Civic Life,False
2026-06-05,2026-06-05_9,9,Where Does the Maine Senate Race Go Next?,The New York Times,New revelations about Graham Platner have left Democrats anxious.,U.S.,https://www.nytimes.com/2026/06/05/us/politics/maine-senate-graham-platner-democrats.html,Politics & Civic Life,False
2026-06-05,2026-06-05_10,10,"Arctic Refuge Oil Auction Draws Few Bids, Despite Trump’s Push for ‘Liquid Gold’",The New York Times,An auction to drill in the Arctic National Wildlife Refuge ended with just 10 percent of the available land claimed for oil development.,Climate,https://www.nytimes.com/2026/06/05/climate/anwr-lease-sale-alaska.html,Science & Technology,False
2026-06-04,2026-06-04_1,1,How Trump’s Proposed Arch Could Complicate D.C.’s Congested Airspace,The New York Times,The mammoth arch would sit directly in the paths of flights in and out of Reagan National Airport.,U.S.,https://www.nytimes.com/interactive/2026/06/04/us/trump-arch-dc-airspace.html,Politics & Civic Life,False
2026-06-04,2026-06-04_2,2,Breakthrough in Embryonic Editing Stirs Debate,The New York Times,"Researchers relied on a newer gene-editing technique that may make it possible to engineer embryos, a prospect that has long alarmed bioethicists.",Science,https://www.nytimes.com/2026/06/04/science/embryos-gene-editing-crispr.html,Science & Technology,False
2026-06-04,2026-06-04_3,3,"In Letter to Putin, Zelensky Mixes Taunts With Proposal for Peace Talks",The New York Times,"“After 26 years in power, age is beginning to take its toll,” President Volodymyr Zelensky of Ukraine wrote of his Russian counterpart, bragging of a recent strike on St. Petersburg.",World,https://www.nytimes.com/2026/06/04/world/europe/zelensky-putin-letter.html,Politics & Civic Life,False
2026-06-04,2026-06-04_4,4,Pilot Was Warned Jet Was Too Low Before It Clipped a Light Pole,The New York Times,"The pilot heard a “thump” while landing in Newark, according to a newly released report. The light pole crashed onto a truck.",New York,https://www.nytimes.com/2026/06/04/nyregion/plane-light-pole-truck-newark.html,Science & Technology,True
2026-06-04,2026-06-04_5,5,Read Nick Bilton’s Memo to ‘60 Minutes’ Staff,The New York Times,The new executive producer of the program sought to lift staff morale after recent high-profile turmoil.,U.S.,https://www.nytimes.com/interactive/2026/06/04/us/bilton-memo.html,Politics & Civic Life,False
2026-06-04,2026-06-04_6,6,"This Time Around, the Killer Is After Your Relatives",The New York Times,"The sixth installment of this low-grade franchise takes a predictable and dismaying turn, even if it feels like the right time to bring the series back.",Movies,https://www.nytimes.com/2026/06/04/movies/scary-movie-review.html,Entertainment & Pop Culture,False
2026-06-04,2026-06-04_7,7,Ohio State Agrees to $100 Million Payout Over Sexual Abuse Claims,The New York Times,"The deal with 279 former students is the latest in the long-running case at the university. In all, nearly 600 people who said they were abused by an athletic department doctor have settled.",U.S.,https://www.nytimes.com/2026/06/04/us/ohio-state-sexual-abuse-settlement.html,Politics & Civic Life,False
2026-06-04,2026-06-04_8,8,New Research Suggests a Possible Path to Prevent Lung Cancer,The New York Times,"Also, senators clashed over Trump’s payout fund. Here’s the latest at the end of Thursday.",Briefing,https://www.nytimes.com/2026/06/04/briefing/lung-cancer-research-trump-fund.html,Science & Technology,True
2026-06-04,2026-06-04_9,9,California Man Accused Of Supplying Tech to Iran,The New York Times,"Jamshid Ghomi, of Newport Coast, Calif., was charged with conspiracy to violate the International Emergency Economic Powers Act.",U.S.,https://www.nytimes.com/2026/06/04/us/sanctions-iran-nuclear-military-violations.html,Politics & Civic Life,False
2026-06-04,2026-06-04_10,10,Officer Is Facing Charges  In Theft of Camera Gear,The New York Times,"Darryl Brown, a sergeant with the Essex County Prosecutor’s Office, is accused of taking home a bag dropped by a photojournalist outside the Delaney Hall immigration detention center in Newark.",New York,https://www.nytimes.com/2026/06/04/nyregion/delaney-hall-protest-officer-charged-stealing.html,Politics & Civic Life,True
2026-06-03,2026-06-03_1,1,Trump Says Iran War Is ‘Not a Big Thing’ for U.S.,The New York Times,It was the latest attempt by President Trump to flip the narrative on a conflict that he once said would lead to quick and decisive victory.,World,https://www.nytimes.com/2026/06/03/world/middleeast/trump-iran-war-remarks.html,Politics & Civic Life,False
2026-06-03,2026-06-03_2,2,Report Reveals Mistreatment Of Detainees by ICE Officers,The New York Times,A report by the Department of Homeland Security’s internal watchdog described officers putting one man in a chokehold and stabbing another with a pen.,U.S.,https://www.nytimes.com/2026/06/03/us/politics/louisiana-ice-facility-mistreated-immigrants.html,Politics & Civic Life,False
2026-06-03,2026-06-03_3,3,G.O.P. Lawmakers Test  Trump’s Grip on Party,The New York Times,The president’s unilateral and retributive style of governing is starting to hit a wall in both chambers of Congress.,U.S.,https://www.nytimes.com/2026/06/03/us/politics/republicans-trump-fund-iran-war-elections.html,Politics & Civic Life,False
2026-06-03,2026-06-03_4,4,Ted Danson Apologizes for Blackface Roast of Whoopi Goldberg in 1993,The New York Times,"The actor’s monologue drew condemnation from figures including David N. Dinkins, New York’s first Black mayor.",Arts,https://www.nytimes.com/2026/06/03/arts/ted-danson-blackface-whoopi-goldberg-apology.html,Entertainment & Pop Culture,False
2026-06-03,2026-06-03_5,5,Obscure Group With Trump Ties Plans to Route Funds to His Allies for Legal Fights,The New York Times,A nonprofit called the Lawfare Defense Fund has raised $36 million to support those who consider themselves unjust victims of the legal system with grants to pay for litigation.,U.S.,https://www.nytimes.com/2026/06/03/us/politics/trump-lawfare-defense-fund.html,Politics & Civic Life,False
2026-06-03,2026-06-03_6,6,Desalination Helps Ease Western States’ Water Strain,The New York Times,"A decade-old treatment plant in San Diego County, Calif., could leave more water in the Colorado River for states facing severe shortages.",Climate,https://www.nytimes.com/2026/06/03/climate/arizona-nevada-san-diego-water.html,Science & Technology,False
2026-06-03,2026-06-03_7,7,NASA Ends Mission of Spacecraft That Orbited Mars for 11 Years to Study Its Air,The New York Times,"The space agency announced that the MAVEN spacecraft, which has circled Mars for more than a decade, is being decommissioned.",Science,https://www.nytimes.com/2026/06/03/science/nasa-maven-mars-orbiter.html,Science & Technology,False
2026-06-03,2026-06-03_8,8,Justices Signal Limited Role for Federal Courts in Redistricting,The New York Times,"In an emergency ruling on Tuesday night, the court’s conservative majority gave a first glimpse into congressional district battles under a weakened Voting Rights Act.",U.S.,https://www.nytimes.com/2026/06/03/us/politics/supreme-court-voting-rights-alabama.html,Politics & Civic Life,False
2026-06-03,2026-06-03_9,9,The House Votes to End the Iran War,The New York Times,"Also, the N.B.A. finals tips off. Here’s the latest at the end of Wednesday.",Briefing,https://www.nytimes.com/2026/06/03/briefing/house-iran-war-powers.html,Politics & Civic Life,True
2026-06-03,2026-06-03_10,10,SpaceX’s I.P.O. Is Poised To Raise Record $74 Billion,The New York Times,The $135 share price means Elon Musk’s rocket maker is poised to exceed the 2019 initial public offering of Saudi Aramco in both valuation and money raised.,Technology,https://www.nytimes.com/2026/06/03/technology/spacex-ipo-pricing.html,Science & Technology,False
2026-06-02,2026-06-02_1,1,"In Iowa, a Long Senate Primary Draws to a Close",The New York Times,"Josh Turek and Zach Wahls, the Democratic candidates for U.S. Senate, made their final pitches as voters took to the polls on Tuesday.",U.S.,https://www.nytimes.com/2026/06/02/us/politics/in-iowa-a-long-senate-primary-draws-to-a-close.html,Politics & Civic Life,False
